title;story
Сircus girl;"My mum can fit inside a jar. SHEILA SPANGLE THE AMAZING CONTORTIONIST
reads the sign on our caravan.
Papa’s Herman the Mighty Magician. And my older brother Anthony is a
trapeze artist.
I’m Cassie, the Family Disappointment. Can’t fold my body into a tiny
ball. Can’t produce coins from behind people’s ears. And unlike Anthony,
I’m terrified of heights.
My only skill is I play the violin.
'Like an angel,' says Madam Zizinski, my music teacher.
'Like a squawking bird,' says Anthony.
'You’re a circus girl, Cassie,' Mama says. 'Circus girls don’t play the
violin.'
'You’ve a rare gift,' says Madam Zizinkski.
I believe her. Between acts, she tells fortunes with her crystal ball.
After Tuesday night’s show I’m practising my music when the circus owner
stands outside our van talking to Papa.
Usually Mr Sharman speaks with a cheerful voice. Tonight he sounds
serious.  'Profits are down,’ he says. ‘I’m going to have to let some of
our people go.’
I wonder if Mr Sharman is going to sack our whole family. Then where
would we go? The circus is our life.
Next day I find Madam in her van packing a suitcase.
'Where are you going?' I ask.
Madam reaches out and draws me to her.  'Oh little one,' she says in her
heavy accent. 'I will miss you so much. Mr Sharman has given me my
marching orders.'
'You’re marching? Are you in a new act?'
Madam smiles. 'No, ma petite. I am leaving the circus.'
It’s too much! I burst into tears.
Madam croons soft and low in my ear as she rocks me.
'I want to go with you,' I blubber.
'I’m going to visit my family in Europe,' Madam says. 'It is a good thing.'
'Not for me.'
Madam sighs. 'You will be sad for a while. But, dearest Cassie, it will
not last.'
'Yes it will. You’re my best friend.'
Madam Zizinski slips me off her lap. 'Look, little one. Look into the ball.'
When Madam peers into her crystal ball, she can see into the future.
'Ah!' she says. 'Here you are. I see many happy people around you.'
I peer into the ball.  'Where am I?'
'In a good place,' says Madam. 'The angel has played her music. And
soothed the savage beast.'
Next day I want to be happy. But I feel lost when Madam leaves.
Mama gives me Calipso, our youngest chimp. 'Look after her; like you
would a baby.'
Mr Sharman sold Calipso’s mother to a zoo. I hug my new pet and mutter
angry words about Mr Sharman.
Calipso pokes her fingers into my mouth. And up her nose. Even though he
makes me laugh, I’m still sad. I’m even sadder when Mr Sharman sacks
Shortie, the lion tamer.
'Herman,' the boss tells Papa, 'I want Cassie and Calipso to be part of
your new act.'
Papa has to teach Calipso tricks. I have to play the violin.
I’m scared. I don’t want to perform.  My music isn’t good enough.
That night, all night, our circus elephant Ellie trumpets. Nobody can
sleep.          'Shut that jumbo up,' Mr Sharman tells Papa.
Papa talks softly to Ellie. But still she trumpets.
'Go play her some music, Cassie,' says Mama.
I grumble as it’s cold outdoors, but do as I’m told. I play a polka and
then a waltz. Soon Ellie has calmed.
'Look,' says Papa, 'She’s dancing!'
It’s true. Ellie’s swaying in time with my music.
For the first time ever I don’t feel like the Family Disappointment.
Mama fits Papa and me with colourful clown outfits. I have a red,
plastic nose and a purple wig.
Calipso claps his hands and somersaults when he sees me. He curls back
his lips and bobs his head up and down.
'Don’t laugh at me, you naughty boy!' I say.
I’m so scared about performing. Mama hugs me. 'Do your best,' she whispers.
In the Big Top the show goes on. Mama squashes herself in her jar. Then
Anthony, so strong and handsome, flies on the trapeze.
I’m on next.
'Presenting Cassie, Calipso and Charlie, the Incredible Clowns!'
announces Mr Sharman.
The three of us hurtle into the ring. Papa and Calipso tumble while I
play a cheerful tune. Then they chase one another while I play as fast
as I can.
When I stop, Papa bellows, 'What’s this?' He pulls a bunch of flowers
out of a boy’s ear.
It’s a trick, of course. But the kid is amazed.
Calipso grabs Papa’s flowers and races off. Papa chases him. I play
again. My music is sweet and the people are swaying in time with it.
People love Calipso’s antics. And Papa’s magic. If only Madam Zizinski
was here to hear me play. She’d enjoy our act so much!
While we entertain, workers build a cage in the ring for the big cats.
When it’s finished, Papa, Calipso and I bow and leave.
'You were wonderful, Cassie,' says Mama, waiting in the wings.
Papa and I stay to watch the big cats. All day they’ve been roaring,
pacing up and down.
'They miss Shorty,' says Papa. 'I don’t like the look of them.'
Down the chute the four of them go. Snarling and showing their razor-
sharp teeth.
Sheila the tigress looks extra mean. She snaps at Mr Sharman. He bellows
at her. Flicks his whip on her rump.
Now the lions are perched on their stands. When Mr Sharman tries to get
Big Boy to jump through a hoop, he refuses.
'He’d do it easy for Shorty,' I whisper.
The audience starts a slow hand clap. Mr Sharman yells at Big Boy and
whips him, hard.
In a flash Sheila leaps from her stand. She crashes into Mr Sharman and
knocks him down.
'Oh no!' the audience cries.
Papa charges into the cage.
'Don’t go, Papa!' I scream.
Now Anthony is going in, too!
Papa grabs Mr Sharman’s whip and flicks it at Sheila and Big Boy. Mr
Sharman is lying still on the ground. People are screaming. Calipso has
his hands over his eyes and is whimpering.
Sheila bares her teeth. Marcelle paces back and forth, roaring.  So do
Big Boy and Roman. They’ve never been so angry. So fierce. So scary.
I wish there was something I could do.
Then I remember: 'You will sooth the savage beast,' Madam Zizinski said.
I tuck my violin under my chin, raise my bow, and play the sweetest
music I know.
Anthony pulls Mr Sharman to the cage door.
Papa is trying to herd the cats into the chute but they won’t go. They
don’t seem to hear my music. For sure Sheila is going to leap onto Papa.
Tear him to pieces.
Not one of the cats is doing what Papa tells them. Shorty would have
sorted them out in a flash. But Papa has never worked the cats before.
They’re fierce and so, so mean.
I close my eyes and focus on my music. But the cats don’t seem to hear it.
All alone, Papa is struggling for control. The cats bellow at him,
refusing to do as he says.
Now, remembering how my music calmed Ellie, I start up a waltz. /Da Da
Da, Da Du Da Da!/
Now Sheila comes to the side of the cage, roaring. I would like to yell
at her to behave herself. But I need to concentrate on my tune.
One of Sheila’s ears is raised. She looks straight at me. She hears my
music!  Marcelle, Big Boy and Roman are quiet now, too. The people are
hushed. Papa’s whiplash sizzles in the air.
I keep playing my waltz. /Da Da Da, Da Du Da Da!/  The audience begins
clapping in time. The spotlight swings onto me.
Sheila’s tail slaps against the cage bars. It’s as though she’s
clapping, too. When she growls, it’s a good growl, a way of saying
something nice. I smile at her.
Marcelle now plods towards the chute. Big Boy follows her. And Roman,
too. Before they pass the door, each of them turns and growls, as though
saying 'Thank you, Cassie.’
I want to cry and to thank /them/ for being good.
Now only Sheila is left in the ring.
'Come on, girl!' Papa shouts.
As meekly as a kitten, Sheila pads over to the chute, turns, and growls
kindly at me.
When her tail disappears, I stop playing and stretch my aching fingers.
I’ve never played so long before. Nor as good.
Papa closes the chute door, smiles at me and bows to the audience.
People start clapping and foot-stamping and calling, 'Circus girl!
Circus girl!'
They’re cheering me! Me, Cassie Spangle.
Papa grins. Mama sweeps me into her arms and hugs me. 'Well done,
Cassie, well done!'
'I’m proud of you,' Anthony says.
Calipso claps.
'Bow,' whispers Papa.
I bow.
Madam Zizinski would be so proud."
The Husband who was to Mind the House;"Once upon on a time there was a man so grumpy and cross he never thought
his wife did anything right in the house. So one evening, in haymaking
time, he came home, scolding and swearing, and showing his teeth and
making a dust.
'Dear love, don’t be so angry; there’s a good man,' said his good wife;
'tomorrow let’s change our work. I’ll go out with the mowers and mow,
and you shall mind the house at home.'
Yes, the husband thought that would do very well. He was quite willing,
he said.
So, early next morning, his wife took a scythe over her neck, and went
out into the hayfield with the mowers and began to mow; but the man was
to mind the house, and do the work at home.
First of all he wanted to churn the butter; but when he had churned a
while he got thirsty, and went down to the cellar to tap a barrel of
ale. So, just when he had knocked in the bung, and was putting the tap
into the cask, he heard overhead the pig come into the kitchen. Then off
he ran up the cellar steps, with the tap in his hand, as fast as he
could, to look after the pig, lest it should upset the churn; but when
he got up, and saw the pig had already knocked the churn over, and stood
there, routing and grunting amongst the cream which was running all over
the floor, he got so wild with rage that he quite forgot the ale-barrel,
and ran at the pig as hard as he could. He caught it, too, just as it
ran out of doors, and gave it such a kick that piggy lay for dead on the
spot. Then all at once he remembered he had the tap in his hand; but
when he got down to the cellar, every drop of ale had run out of the cask.
Then he went into the dairy and found enough cream left to fill the
churn again, and so he began to churn, for butter they must have at
dinner. When he had churned a bit, he remembered that their milking cow
was still shut up in the stable, and hadn’t had a bit to eat or a drop
to drink all the morning, though the sun was high. Then all at once he
thought ’twas too far to take her down to the meadow, so he’d just get
her up on the roof — for the house, you must know, was thatched with
sods, and a fine crop of grass was growing there. Now their house lay
close up against a steep bank, and he thought if he laid a plank across
to the thatch at the back he’d easily get the cow up.
But still he couldn’t leave the churn, for there was his little babe
crawling about on the floor, and 'if I leave it,' he thought, 'the child
is sure to upset it.' So he took the churn on his back, and went out
with it; but then he thought he’d better first water the cow before he
turned her out on the thatch; so he took up a bucket to draw water out
of the well; but, as he stooped down at the well’s brink, all the cream
ran out of the churn over his shoulders, and so down into the well.
Now it was near dinner-time, and he hadn’t even got the butter yet; so
he thought he’d best boil the porridge, and filled the pot with water,
and hung it over the fire. When he had done that, he thought the cow
might perhaps fall off the thatch and break her legs or her neck. So he
got up on the house to tie her up. One end of the rope he made fast to
the cow’s neck, and the other he slipped down the chimney and tied round
his own thigh; and he had to make haste, for the water now began to boil
in the pot, and he had still to grind the oatmeal.
So he began to grind away; but while he was hard at it, down fell the
cow off the housetop after all, and as she fell she dragged the man up
the chimney, by the rope. There he stuck fast; and as for the cow, she
hung half-way down the wall, swinging between heaven and earth, for she
could neither get down nor up.
And now the wife had waited seven lengths and seven breadths for her
husband to come and call them home to dinner; but never a call they had.
At last she thought she’d waited long enough, and went home. But when
she got there and saw the cow hanging in such an ugly place, she ran up
and cut the rope in two with her scythe. But as she did this, down came
her husband out of the chimney; and so when his old lady came inside the
kitchen, there she found him standing on his head in the porridge-pot."