title;story
The Four Clever Sheep;"Farmer Mick and his dog Tiger lived on a sheep farm. One morning they
set off in the truck to buy some sheep. When they arrived at the market
they bought four sheep called Magic, Big Rogue, Slick and Pixie. Tiger
helped load them onto the truck and soon they were on the way back to
the farm.
Farmer Mick did not know that his new sheep were very clever. They liked
Weeping Grass because it was very sweet to eat. They liked Windmill
Grass because it grew tall and they could lie down and hide, and they
liked Silky Blue Grass because it had lots of ripe seed heads.
One day when Farmer Mick was in town, Magic made his way to the top of
the hill. When Big Rogue, Slick and Pixie caught up, Magic called them
to a meeting.
'Right,' said Magic. 'I like this farm. Farmer Mick owns the best farm
ever and we must be very clever to get to all that beautiful grass.
Because our coats are the same colour as the grass, when we get there we
can disappear very easily.'
'Look,' said Big Rogue, 'I can see plenty of Weeping Grass over there.'
'Yes, and I can see a big field of Windmill Grass further on,' said Big
Rogue.
'All that Silky Blue Grass makes me feel hungry,' said Slick.
Pixie pushed her way to the front and gave a little jump so she could
see better.
'Let me see, let me see,' she said. But by then the others were walking
back down the hill to the farm and she had to run after them.
When Farmer Mick returned, they were all standing quietly next to the
farmhouse gate.
The very next day Magic put their plan into action. As soon as the coast
was clear Big Rogue pushed against the fence until he had made a gap.
Slick and Pixie came to help and soon they could all squeeze through
into the next field where the tall Weeping Grass was growing. They ate
and ate until they were all very full. Because the grass was so high
they disappeared from view.
Farmer Mick and Tiger looked everywhere but couldn't find the clever
sheep so they decided to look for them in the morning.
Pixie was lying in the middle of the field and Magic, Big Rogue and
Slick were a little further away. Their tummies were full and it was
such a warm day that they all fell sound asleep. When they woke up the
stars were out.
Very, very early the next day, Magic and the mob pushed at the fence
until they could squeeze through into the field with the Windmill Grass.
What a feast they had. The seed heads were full and the tips of the
leaves were small crunchy and sweet, just what they liked best.
Big Rogue wanted to get to the Silky Blue Grass paddock because it was
very tall and they could hide more easily. Magic agreed, so very quietly
and on tiptoe, they pushed their way into the Silky Blue Grass and
disappeared out of sight. All that day they ate and ate, choosing the
best bits.
'Well, I'll be blowed,' Mick said to Tiger, 'where are they? Did I buy
invisible sheep?'
The fact that Farmer Mick thought they were all invisible made Pixie
giggle and soon they were all trying not to laugh out loud. Magic was
trying to keep them quiet. But it was too late, Tiger heard them and the
game was up.
'Well, well, well,' said Mick, 'my four white sheep are not invisible,
they are just very clever. They are also very greedy and have grown
quite fat on all the grass they have eaten. So off they go to the sheep
sales.'
The next day as the four clever sheep were being taken to the sale yards
Magic began to tell them about his next plan.
'No, no, no,' said Pixie,' no more of your plans Magic, from now on I
will be the leader because I am the smallest.'
'No, no, no' said Slick, 'I will be leader because I am the strongest.
'You are both wrong, it will be my turn because I'm the biggest,' said
Big Rogue.
No one knows where they are now but you can be sure they will all still
be arguing."
The Fairy;Once upon a time there was a widow who had two daughters. The elder was so much like her, both in looks and character, that whoever saw the daughter saw the mother. They were both so disagreeable and so proud that there was no living with them. The younger, who was the very picture of her father for sweetness of temper and virtue, was withal one of the most beautiful girls ever seen. As people naturally love their own likeness, this mother doted on her elder daughter, and at the same time had a great aversion for the younger. She made her eat in the kitchen and work continually. Among other things, this unfortunate child had to go twice a day to draw water more than a mile and a half from the house, and bring home a pitcherful of it. One day, as she was at this fountain, there came to her a poor woman, who begged of her to let her drink. Oh, yes, with all my heart, Goody,  said this pretty little girl. Rinsing the pitcher at once, she took some of the clearest water from the fountain, and gave it to her, holding up the pitcher all the while, that she might drink the easier. The good woman having drunk, said to her:-- You are so pretty, so good and courteous, that I cannot help giving you a gift.  For this was a fairy, who had taken the form of a poor country-woman, to see how far the civility and good manners of this pretty girl would go.  I will give you for gift,  continued the Fairy,  that, at every word you speak, there shall come out of your mouth either a flower or a jewel.  When this pretty girl returned, her mother scolded at her for staying so long at the fountain. I beg your pardon, mamma,  said the poor girl,  for not making more haste.  And in speaking these words there came out of her mouth two roses, two pearls, and two large diamonds. What is it I see there?  said her mother, quite astonished.  I think pearls and diamonds come out of the girl mouth! How happens this, my child? This was the first time she had ever called her  my child.  The girl told her frankly all the matter, not without dropping out great numbers of diamonds. Truly,  cried the mother,  I must send my own dear child thither. Fanny, look at what comes out of your sister s mouth when she speaks. Would you not be glad, my dear, to have the same gift? You have only to go and draw water out of the fountain, and when a poor woman asks you to let her drink, to give it to her very civilly. I should like to see myself going to the fountain to draw water,  said this ill-bred minx. I insist you shall go,  said the mother,  and that instantly.  She went, but grumbled all the way, taking with her the best silver tankard in the house. She no sooner reached the fountain than she saw coming out of the wood, a magnificently dressed lady, who came up to her, and asked to drink. This was the same fairy who had appeared to her sister, but she had now taken the air and dress of a princess, to see how far this girl s rudeness would go. Am I come hither,  said the proud, ill-bred girl,  to serve you with water, pray? I suppose this silver tankard was brought purely for your ladyship, was it? However, you may drink out of it, if you have a fancy.  You are scarcely polite,  answered the fairy, without anger.  Well, then, since you are so disobliging, I give you for gift that at every word you speak there shall come out of your mouth a snake or a toad.  So soon as her mother saw her coming, she cried out:-- Well, daughter?  Well, mother?  answered the unhappy girl, throwing out of her mouth a viper and a toad. Oh, mercy!  cried the mother,  what is it I see? It is her sister who has caused all this, but she shall pay for it, and immediately she ran to beat her. The poor child fled away from her, and went to hide herself in the forest nearby. The King s son, who was returning from the chase, met her, and seeing her so beautiful, asked her what she did there alone and why she cried. Alas! sir, my mother has turned me out of doors.  The King s son, who saw five or six pearls and as many diamonds come out of her mouth, desired her to tell him how that happened. She told him the whole story. The King s son fell in love with her, and, considering that such a gift was worth more than any marriage portion another bride could bring, conducted her to the palace of the King, his father, and there married her. As for her sister, she made herself so much hated that her own mother turned her out of doors. The miserable girl, after wandering about and finding no one to take her in, went to a corner of the wood, and there died.
The Princess and the Pea;"There was once a prince who wanted to marry a princess. But she must be a real princess, mind you. So he traveled all round the world, seeking such a one, but everywhere something was in the way. Not that there was any lack of princesses, but he could not seem to make out whether they were real princesses; there was always something not quite satisfactory. Therefore, home he came again, quite out of spirits, for he wished so much to marry a real princess. One evening a terrible storm came on. It thundered and lightened, and the rain poured down; indeed, it was quite fearful. In the midst of it there came a knock at the town gate, and the old king went out to open it. It was a princess who stood outside. But O dear, what a state she was in from the rain and bad weather! The water dropped from her hair and clothes, it ran in at the tips of her shoes and out at the heels; yet she insisted she was a real princess. Very well,  thought the old queen;  that we shall presently see.  She said nothing but went into the bedchamber and took off all the bedding, then laid a pea on the sacking of the bedstead. Having done this, she took twenty mattresses and laid them upon the pea and placed twenty eider-down beds on top of the mattresses. The princess lay upon this bed all the night. In the morning she was asked how she had slept. Oh, most miserably!  she said.  I scarcely closed my eyes the whole night through. I cannot think what there could have been in the bed. I lay upon something so hard that I am quite black and blue all over. It is dreadful!  It was now quite evident that she was a real princess, since through twenty mattresses and twenty eider-down beds she had felt the pea. None but a real princess could have such delicate feeling. So the prince took her for his wife, for he knew that in her he had found a true princess. And the pea was preserved in the cabinet of curiosities, where it is still to be seen unless some one has stolen it. And this, mind you, is a real story."
Cinderella;"Cinderella's mother died while she was a very little child, leaving her
to the care of her father and her step-sisters, who were very much older
than herself; for Cinderella's father had been twice married, and her
mother was his second wife. Now, Cinderella's sisters did not love her,
and were very unkind to her. As she grew older they made her work as a
servant, and even sift the cinders; on which account they used to call
her in mockery 'Cinderella.' It was not her real name, but she became
afterwards so well known by it that her proper one has been forgotten.
She was a very sweet-tempered, good girl, however, and everybody (except
her cruel sisters) loved her.
CINDERELLA AT HOME.
It happened, when Cinderella was about seventeen years old, that the
King of that country gave a ball, to which all ladies of the land, and
among the rest the young girl's sisters, were invited. And they made her
dress them for the ball, but never thought of allowing her to go there.
CINDERELLA DRESSING HER SISTERS FOR THE BALL.
'I wish you would take me to the ball with you,' said Cinderella, meekly.
'Take you, indeed!' answered the elder sister, with a sneer; 'it is no
place for a cinder-sifter: stay at home and do your work.'
When they were gone, Cinderella, whose heart was very sad, sat down and
cried bitterly; but as she sat sorrowful, thinking of the unkindness of
her sisters, a voice called to her from the garden, and she went out to
see who was there. It was her godmother, a good old Fairy.
'Do not cry, Cinderella,' she said; 'you also shall go to the ball,
because you are a kind, good girl. Bring me a large pumpkin.'
Cinderella obeyed, and the Fairy, touching it with her wand, turned it
into a grand coach. Then she desired Cinderella to go to the trap, and
bring her a rat. The girl obeyed, and a touch of the Fairy's wand turned
him into a very smart coachman. Two mice were turned into footmen; four
grasshoppers into white horses. Next, the Fairy touched Cinderella's
rags, and they became rich satin robes, trimmed with point lace.
Diamonds shone in her hair and on her neck and arms, and her kind
godmother thought she had seldom seen so lovely a girl. Her old shoes
became a charming pair of glass slippers, which shone like diamonds.
'Now go to the ball, my love,' she said, 'and enjoy yourself. But
remember, you must leave the room before the clock strikes /eleven/. If
you do not your dress will return to its original rags. I approve of
pleasure, but not of dissipation, and I expect that you will show your
gratitude by obeying me.'
Cinderella kissed and thanked her godmother. Then she stepped into her
coach and drove off, with her footmen behind, in great style. The Fairy,
when she was gone, returned to Fairyland.
Cinderella was received at the King's palace with great respect. The
Lord Chamberlain bowed low to her, thinking she must be a very great
lady by her dress and carriage, and he showed her at once into the
ball-room.
THE FAIRY GODMOTHER.
She was so beautiful that everybody looked at her, and wondered who she
was; and the Prince asked her to dance with him, and afterwards would
dance with no one else.
ARRIVAL AT THE PALACE.
But she made haste to leave a little before the hour fixed, and had time
to undress before her sisters came home. They told her a beautiful
Princess had been at the ball, with whom the Prince was delighted. They
did not know it was Cinderella herself, and she was amused to hear them
admire her grace and beauty, and say that they were sure she was a royal
lady.
The Prince was quite vexed when supper-time came, and he could not find
his beautiful partner, and no one had seen her leave the room. But in
hopes of beholding her again, he persuaded the King to give another
grand ball. As soon as her sisters were gone to it, Cinderella's
godmother arrived.
'You were so good and obedient last time, that I shall let you go out
again,' said she to the young girl.
And once more the rat, mice, grasshoppers, and pumpkin (which had gone
back to their original shapes after the first ball) were turned into the
grand carriage and attendants, and Cinderella, in rose-coloured satin
and rubies, went to the royal ball.
Directly the Prince saw her, he asked her to dance, and would have no
other partner, and as he led her past her two unkind sisters, she saw
them look at her dress with envious eyes, and knew that they wished they
were as beautiful, and as well-dressed as she was.
But in the midst of her enjoyment, Cinderella remembered the Fairy's
command, and at half-past ten glided out of the room, and drove home
again. Her sisters found her waiting to undress them in her usual rags,
and kept her up to tell her how beautiful the unknown Princess was, and
how well she was dressed.
Again the Prince was vexed at the sudden disappearance of the beautiful
stranger, and once more he persuaded the King to give a grand State ball.
'I wonder if Princess Beauty will be there!' said the sisters to
Cinderella. 'We must have new dresses, for she is so splendid. She makes
every one look shabby.'
CINDERELLA DANCES WITH THE PRINCE.
Cinderella smiled as she helped them to dress. She was sure the Fairy
would let her go to the ball too. And she was right. Her godmother,
pleased with her obedience, came in good time, and Cinderella, dressed
in blue satin and pearls, went in the same style as before.
CINDERELLA RUNS HOME AND LOSES HER SLIPPER.
The Prince would scarcely let her out of his sight, and Cinderella, who
was getting a little spoiled by all the flattery she heard, began to
think more of herself and less of the Fairy; so the time stole on, till
glancing up at the clock, she saw it wanted only five minutes to eleven.
At once she darted out of the room, and ran through the palace as fast
as she could go, but as she reached the hall, she lost one of her
precious glass slippers! She did not stop to pick it up, but rushed to
the door. Alas! the clock had struck
Eleven. She found no coach, only a pumpkin, and the rat and mice ran
quickly away when they saw her; while all her fine dress turned to rags,
and she had to run home alone in the darkness of the night.
The Prince was very much surprised when he missed Cinderella again, and
leaving the ball, went in search of her. He asked all the attendants,
but no one had seen her, and when enquiry was made of the porter, he
said that no one had gone out of the palace except a poor ragged
beggar-girl.
However, the Prince's search was rewarded by his finding the glass
slipper, which he well knew belonged to the unknown Princess. He loved
Cinderella so much that he now resolved to marry her; and as he felt
sure that no one else could wear such a tiny shoe as hers was, he sent
out a herald to proclaim that whichever lady in his kingdom could put on
this glass slipper should be his wife.
All the great ladies who wished to be a Princess tried to put it on, but
in vain. Cinderella's sisters tried, but could not get it on, and then
Cinderella asked if she might try. They laughed at her; but the Prince,
hearing of her wish, sent for her. She went with her sisters in her poor
dress, but very clean, and at once put on the slipper. Then she drew the
fellow of it from her pocket, and slipped it on her other foot.
The Prince, who had thought the moment he saw her that the poor girl was
very much like the beautiful Princess, was delighted. He insisted on
Cinderella telling him her story, which she did very modestly, and all
listened with wonder.
CINDERELLA TRIES ON THE SLIPPER.
As her tale ended, the Fairy godmother suddenly entered the room, and
placing her godchild's hand in the Prince's, said:
'Take this young girl for your wife, Prince; she is good and patient,
and as she has known how to submit to injustice meekly, she will know
how to reign justly.'
CINDERELLA MARRIED TO THE PRINCE.
So Cinderella was married to the Prince in great state, and they lived
together very happily. She forgave her sisters, and treated them always
very kindly, and the Prince had great cause to be glad that he had found
the glass slipper."
